<?xml version="1.0" encoding="UTF-8"?>
<!--
    
    Copyright (C) 2012 DANS - Data Archiving and Networked Services (info@dans.knaw.nl)
    
    Licensed under the Apache License, Version 2.0 (the "License");
    you may not use this file except in compliance with the License.
    You may obtain a copy of the License at
    
    http://www.apache.org/licenses/LICENSE-2.0
    
    Unless required by applicable law or agreed to in writing, software
    distributed under the License is distributed on an "AS IS" BASIS,
    WITHOUT WARRANTIES OR CONDITIONS OF ANY KIND, either express or implied.
    See the License for the specific language governing permissions and
    limitations under the License.
    
-->

<dcx-dai:creatorDetails xmlns:xsi="http://www.w3.org/2001/XMLSchema-instance" xmlns:dcx-dai="http://easy.dans.knaw.nl/schemas/dcx/dai/"
    xsi:schemaLocation="http://easy.dans.knaw.nl/schemas/dcx/dai/ ../../../dcx/2018/08/dcx-dai.xsd">
    <dcx-dai:author>
        <dcx-dai:titles xml:lang="en">B.L.I.S.</dcx-dai:titles>
        <dcx-dai:initials>J.P.H.</dcx-dai:initials>
        <dcx-dai:insertions>van den</dcx-dai:insertions>
        <dcx-dai:surname>Aarden</dcx-dai:surname>
        <dcx-dai:DAI>123456789</dcx-dai:DAI>
        <dcx-dai:role>RelatedPerson</dcx-dai:role>
        <dcx-dai:organization>
            <dcx-dai:name xml:lang="en">Maastricht University</dcx-dai:name>
            <dcx-dai:identifier scheme="ISNI" value="0000 0001 2103 2683" uri="http://isni.org/isni/0000000121032683"/>
        </dcx-dai:organization>
    </dcx-dai:author>
</dcx-dai:creatorDetails>
